{
  "$schema": "http://json-schema.org/draft-07/schema#",
  "type": "array",
  "items": {
    "type": "object",
    "required": ["title", "description", "source_url", "sector", "impact"],
    "additionalProperties": false,
    "properties": {
      "title": { "type": "string", "minLength": 1 },
      "description": { "type": "string" },
      "source_url": { "type": "string", "format": "uri" },
      "sector": { "$ref": "sector-slug" },
      "impact": {
        "type": "string",
        "enum": ["low", "medium", "high"]
      }
    }
  }
}
