[
  {
    "title": "استمرار معاناة النازحين في المخيمات",
    "description": "بحسب تقارير الأمم المتحدة فما زال هناك ملايين النازحين داخل سوريا وبعضهم يعيش في الخيام في ظروف صعبة خاصة في فصل الشتاء تحت الأمطار والسيول.",
    "source_url": "https://ultrasyria.ultrasawt.com/%D8%A7%D9%84%D8%A3%D9%85%D9%85-%D8%A7%D9%84%D9%85%D8%AA%D8%AD%D8%AF%D8%A9-55-%D9%85%D9%84%D8%A7%D9%8A%D9%8A%D9%86-%D9%86%D8%A7%D8%B2%D8%AD-%D8%AF%D8%A7%D8%AE%D9%84%D9%8A-%D9%85%D8%A7-%D8%B2%D8%A7%D9%84%D9%88%D8%A7-%D9%81%D9%8A-%D8%B3%D9%88%D8%B1%D9%8A%D8%A7-%D8%AD%D8%AA%D9%89-%D9%85%D8%B7%D9%84%D8%B9-%D9%81%D8%A8%D8%B1%D8%A7%D9%8A%D8%B1-2026/%D9%81%D8%B1%D9%8A%D9%82-%D8%A7%D9%84%D8%AA%D8%AD%D8%B1%D9%8A%D8%B1/%D8%A3%D8%AE%D8%A8%D8%A7%D8%B1",
    "sector": "administration",
    "impact": "medium"
  },
  {
    "title": "ارتفاع معدلات التضخم وتكاليف المعيشة",
    "description": "يقع جزء كبير من السوريين تحت خط الفقر ويعانون من ارتفاع أسعار السلع وتراجع القدرة الشرائية.",
    "source_url": "https://karamshaar.com/ar/syria-in-figures/%d8%a7%d8%b1%d8%aa%d9%81%d8%a7%d8%b9-%d8%a7%d9%84%d8%a3%d8%b3%d8%b9%d8%a7%d8%b1-%d9%81%d9%8a-%d8%b3%d9%88%d8%b1%d9%8a%d8%a7-2025/",
    "sector": "cost-of-living",
    "impact": "high"
  },
  {
    "title": "ضعف خدمات الاتصالات",
    "description": "يعاني المواطن في سوريا من تدهور خدمات الاتصالات ورغم الإعلان عن مشاريع استراتيجية لإصلاح البنية التحتية لكنها ستستغرق سنوات حتى يتم الانتهاء من تنفيذها وإطلاقها على نطاق واسع.",
    "source_url": "https://www.ajnet.me/ebusiness/2026/2/10/%D9%87%D9%84-%D9%8A%D9%86%D8%AC%D8%AD-%D8%B3%D9%8A%D9%84%D9%83-%D9%84%D9%8A%D9%86%D9%83-%D9%81%D9%8A-%D8%A5%D9%86%D9%82%D8%A7%D8%B0-%D8%A7%D8%AA%D8%B5%D8%A7%D9%84%D8%A7%D8%AA",
    "sector": "technology",
    "impact": "medium"
  }
]